"post","author","comment","upvotes"
"Slipknot in Rupauls drag race","","",""
"A sim getting an abortion","","",""
"Phil Swift Sawing a boat in Half","","",""
"Deadass partyfun","","",""
"beast boy as the vitruvian man","","",""
"Wojak trail cam","","",""
"nuclear explosion by van Gogh","","",""
"""Pull the video up. Oh woow you really sliced all those younglings? That's incredible""","","",""
"Man-made horrors beyond human comprehension","","",""
"guinea pig painted by roy lichtenstein","","",""
"jerma in the back rooms","","",""
"Akira Kurosawa's Samurai Turtles","","",""
"hmm......","","",""
"Darth Vader loves the beach","","",""
"Looks Fun","","",""
"big chungus painted by da vinci","","",""
"good AI","","",""
"batman in an advertisement for alcohol","","",""
"Bill Cosby is the Pope","","",""
"fisher price meth lab","","",""
"Darth Vader and Darth Maul having a princess tea party","","",""
"Liminal Spaces in star wars","","",""
"Darth Vader as a samurai","","",""
"Car made out of Eyeballs","","",""
"Dolly Parton Fighting A Balrog","","",""
"Harry Potter and the Wizard Of Oz","","",""
"No not getting those Hot Fuzz sketches. It's just the one sketch actually.","","",""
"the fbi arresting a bottle of ketchup","","",""
"Hitler Ted talk","","",""
"Dolly Parton Fighting A Balrog","","",""
"unchained melody","","",""
"cannabis plantation around the White House","","",""
"Rambo performing dead","","",""
"Walter White in Regular Show","","",""
"Genghis Khan conquering the basketball court","","",""
"Rambo performing live","","",""
"Sayings, idioms and colloquialisms #6","","",""
"a soccer player using a bazooka during a game","","",""
"Goths on CCTV outside of McDonald's","","",""
"Mario Mma","","",""
"Well this is something.","","",""
"donald trump kissing a tree","","",""
"“Let them fight”","","",""
"wombats being weird little sirs","","",""
"a Japanese castle sits on a hill overlooking the Grand Canyon","","",""
"Jake from State Farm Gigachad","","",""
"Forgot I wasn’t a stand user","","",""
"Sayings, idioms and colloquialisms #5","","",""
"bill gates as superman","","",""
"What The End Of The World Will Look Like","","",""
"Darth Vader ordering at McDonald's","","",""
"Cartoon Seinfeld est.1930","","",""
"wombats painted by matisse","","",""
"Do you believe in God?","","",""
"Photograph of a sumo wrestling sloth","","",""
"queen elizabeth surfing with an alligator","","",""
"Danny devito trail cam footage","","",""
"goth kids at the county fair","","",""
"Joseph Stalin Happy Meal Toy","","",""
"Captain Kirk with a Mohawk","","",""
"Jesus singing on Euvovision","","",""
"capybara doing pull up","","",""
"Death Grips At Tiananmen Square","","",""
"titles are hard.","","",""
"""I am your oppa.""","","",""
"WALL-E by DALL-E, but happy in a forest with a cockroach","","",""
"Courtroom sketch of Playboi Carti suing a New York rat","","",""
"Pope in a WWE SMACKDOWN","","",""
"Assassin's Creed: Voldemort","","",""
"Scientific diagram of fruit salad","","",""
"Darth Vader In A Seinfeld Episode","","",""
"Gave this a try lol","","",""
"Bop to the Top🎶","","",""
"Patent Drawing of Ted Cruz","","",""
"RIP Hamburglar","","",""
"this explains a lot","","",""
"teddy bears doing a podcast","","",""
"Batman in a field at golden hour with an out of focus background","","",""
"Astronaut","","",""
"MyPillow!","","",""
"Cancer cell as an Adventure Time character","","",""
"I think it cheats at Tic Tac Toe","","",""
"pin-up panda bears","","",""
"Bernie Sanders posing with sonic the hedgehog","","",""
"The Afterlife","","",""
"Angela Merkel shaking hands with Kim Jon Un","","",""
"Isabella of Spain eating pizza","","",""
"Morbidly obese anime catgirl smoking cigarette while riding moped at sunset","","",""
"John Cena eating a watermelon","","",""
"Snoop Dogg joins The Manson Family","","",""
"Ask creepy questions, get creepy answers","","",""
"George Washington accepting his Kids Choice Award","","",""
"Blobfish burger buns","","",""
"only one of them are smiling","","",""
"He seems to have been made to suffer...","","",""
"Someone who loves me (edited for joke)","","",""
"police sketch of tony hawk eating a tomato","","",""
"melon","","",""
"Goofy self-immolating","","",""
"Gibby fighting Darth Vader on Mustafar","","",""
"kim yong-un in Dancing with the stars","","",""
"Jerusalem Lego Set","","",""
"The Smurfs WWE entrance","","",""
"ALL GLORY TO THE HYPNOTOAD!","","",""
"Space shuttle launch in breath of the wild","","",""
"Bill Gates with lobster hands","","",""
"Tiger Woods eating spaghetti","","",""
"Boris Johnson in club penguin","","",""
"Till Lindemann reading the Necronomicon to Children","","",""
"Chair smiling","","",""
"bigfoot foot lettuce","","",""
"Kermit knocks out Tyson","","",""
"Mark Zuckerburg with Aliens","","",""
"Oh...Ok, im sorry","","",""
"Fisher Price my first guillotine","","",""
"Minion committing arson","","",""
"Snoop stars on Beavis and Butthead","","",""
"Mister Rogers showing his mahjong pieces","","",""
"Balrog eating at a fancy restaurant","","",""
"Voldemort Clash Royale Card","","",""
"Cortana, how many tablespoons are in a cup?","","",""
"I can't believe it took me this long to think of illuminated manuscripts...","","",""
"A bear in a grocerey shopping for food","","",""
"Barney caught by border patrol","","",""
"morbidly obese blobfish","","",""
"Max Rebo Jeopardy","","",""
"One, two, Kermit's coming for you...","","",""
"Godzilla Smoking Crack","","",""
"Shrek playing in NHL","","",""
"donald trump playing baseball","","",""
"Hank Hill on trial for murder courtroom sketch","","",""
"Quinceañera at Trader Joe’s (inspired by funeral at Whole Foods)","","",""
"The Muppets improve every film they're put into, so this should be awesome...","","",""
"Saul Goodman Metal Gear Rising","","",""
"Osama Bin Laden playing basketball","","",""
"""first alien president of the united states""","","",""
"Daenerys Targaryen riding a capybara","","",""
"Jotaro's gonna be sentenced for something else very soon","","",""
"Donald Trump with Darth Vader","","",""
"Mt Fuji behind the US Capitol","","",""
"sloth crossfit champion","","",""
"Elton John painted by Leonardo da Vinci","","",""
"Playboy magazine with a cat on the cover","","",""
"the Twin Towers as a Mario Kart track","","",""
"Elon Musk Vaporwave","","",""
"Barbie Mothership (by me)","","",""
"Darth Vader Fisher Price Phone","","",""
"Hank Hill growing Marijuana in a garage","","",""
"Xenomorph riding a hoverboard","","",""
"Catholic Lego sets.","","",""
"Ozzy Osbourne cabbages","","",""
"Spanish inquisition in front of the Whitehouse","","",""
"Man eating a tesseract","","",""
"🗿 🗿🗿🗿🗿","","",""
"Lisa Frank Urinal","","",""
"Cockpit view of 9/11","","",""
"Weird how some are strangely realistic but the others didn’t add them at all","","",""
"Vegeta Frida Kahlo","","",""
"Dall-e paints Dali","","",""
"Do you hear the Muppets sing? Singing a song of angry felt!","","",""
"Cthulhu Ming Vase","","",""
"Muppets in Vietnam","","",""
"Mitch McConnell eating pizza on the beach","","",""
"Emperor Zurg presenting at a middle school assembly","","",""
"fisher price ak47","","",""
"Chicken nuggets reading books","","",""
"Gay frogs wedding","","",""
"my little pony medieval torture device","","",""
"Jabba the Hut Hosting The Price Is Right","","",""
"Larry King Picking Up a Prostitute in Skid Row","","",""
"love is girls or cats it seems","","",""
"Byzantine icon of Col. Sanders","","",""
"great white sharks in a bathtub","","",""
"Memes","","",""
"Mother Teresa Funko Pop figure","","",""
"monkeys playing golf","","",""
"Thanos Holding a Fidget Spinner","","",""
"For your consideration","","",""
"Cloud strife receiving the nobel peace prize","","",""
"Madonna eating beans","","",""
"Clams in a Casino","","",""
"Edward scissorhands on jeopardy","","",""
"R2D2 would be jealous","","",""
"Little Tikes Delorean","","",""
"naruto as spiderman ?!","","",""
"ostrich on the international space station","","",""
"Sloth avenger","","",""
"Babies in MMA","","",""
"a dog with a purple duck head","","",""
"Happy Batman","","",""
"spooky","","",""
"GoPro footage of the First Jewish-Roman War","","",""
"ostriches rampaging through a shopping mall","","",""
"Pyramid Head getting married","","",""
"Jerma","","",""
"Lady Gaga making kimchi","","",""
"#weddingmemories #weddingideas #alwaysandforever #silenthill","","",""
"ufo abducting a hamburger","","",""
"Down! Bad Wall-E! Well, now we know why one leg was a different colour...","","",""
"Animal Crossing in the Last Supper.","","",""
"simpsons drawn as medieval art","","",""
"U.S. Army fights Talibans with Toilet Paper","","",""
"J Edgar Hoover skiing","","",""
"Trail cam footage of Markiplier eating a block of cheese","","",""
"Fossilized Furby Skeleton","","",""
"Spiderman, in the style of Gustav Klimt","","",""
"Danny Devito fights Francis Ngannou in the octagon","","",""
"Danny DeVito playing with hot wheels","","",""
"bbc sherlock and lurch in a film noir","","",""
"Shhhh! I'm trying to read!!","","",""
"Dragon Ball Z: Kitchen Nightmares","","",""
"Chewbacca on My 600 Lb Life","","",""
"Heroin user Squidward","","",""
"Finally found them","","",""
"Meredith Grey looking for her mom at Walmart","","",""
"Isabelle Animal Crossing speaking before US senate 1996.","","",""
"50 ft Catholic priest in Paris","","",""
"Jesus rapping","","",""
"Ginyu force on america's got talent","","",""
"I closed my eyes and blindly picked 3 emojis. This is what happened.","","",""
"guy licking his toes","","",""
"Donald Trump swimming","","",""
"Popcorn Machine filled with Human Teeth","","",""
"fisher price my first demon","","",""
"furby with a gun","","",""
"Sh***er was full","","",""
"Cat in the Hat courtroom sketch","","",""
"dinosaurs working out on muscle beach","","",""
"Tofu Burglar","","",""
"inflatable joe biden","","",""
"Captain Planet Playing Tuba","","",""
"Donald","","",""
"springtrap in mario kart 8","","",""
"Halo Master Chief at prom","","",""
"Wish it. Want it. Wubba Lubba Dub Dub.","","",""
"He is risen.","","",""
"Snoop Glass","","",""
"Boris Johnson fishing with the Taliban","","",""
"Gumby Funeral","","",""
"Black Sabbath White Wedding","","",""
"shirtless men at a cat cafe petting cats","","",""
"Oreo Breathing: First form -Double Stuff","","",""
"Kermit the Frog on American Ninja Warrior","","",""
"Marlon Brando performing with the Muppets","","",""
"Darth Vader eating a cake riding a rollercoaster","","",""
"Joe Biden playing poker with dogs","","",""
"Ku Klux Klan gay pride","","",""
"Dumplings and Cheese with Chives? idk what are those cheese peas?","","",""
"SEAL Team 6 stars on Sesame Street","","",""
"Boris Johnson being attacked by wolves in Glasgow","","",""
"Bill Cosby making a cocktail","","",""
"Ronald Mcdonald being hanged","","",""
"Jeffy finds a gun in his sphagetti","","",""
"darth vader skiing","","",""
"humpty Dumpty heavy metal album cover","","",""
"Hikaru Utada eating corn","","",""
"Jason voorhees on jimmy fallon","","",""
"Wikipedia description: The lion is a muscular, broad-chested cat with a short, rounded head, a reduced neck and round ears...","","",""
"Grim reaper on x-factor","","",""
"Sherlock Holmes interrogating a highland cow","","",""
"Dustbinman Ronaldo sueyyyyy","","",""
"Elmo marrying Princess Diana","","",""
"boris johnson in genshin impact","","",""
"Charlie Brown Deadpool","","",""
"Watamote Tomoko grocery shopping","","",""
"Marlon Brando as Captain of the Enterprise","","",""
"alcoholic ronald mcdonald smoking cigarettes in the back alley","","",""
"Depressed Chicken Nugget","","",""
"Barbie joins Jig Saw in a saw movie","","",""
"some heroclix","","",""
"Frog Paste","","",""
"Self portrait","","",""
"Fisher price My First Meth Lab","","",""
"at least he's well educated.","","",""
"Joe Biden fishing trip in Sahara Desert","","",""
"A potato shaped baby","","",""
"Pikachu at a Trump rally","","",""
"Sesame kart","","",""
"Carl Sagan as Captain of the Enterprise","","",""
"Darth Vader with a big bag of cash","","",""
"It looks like he committed war crimes","","",""
"A woman giving birth to a pizza","","",""
"Animal Crossing Illuminati indoctrination","","",""
"Stephen Hawking on American Ninja Warrior","","",""
"Finally I can bring my dreams to life","","",""
"Jar of JIF as a Civil War soldier, black and white portrait","","",""
"A bionicle witnessing the birth of Christ","","",""
"Kool Aid Man Mosh Pit","","",""
"art nouveau muppets","","",""
"Wholesome Evangelion and Spongebob","","",""
"Claptrap in WWE","","",""
"Chewy Miss America","","",""
"I guess there isn't anything to see here","","",""
"The face of Dall•e","","",""
"Sailor Moon working at McDonald's.","","",""
"Michael Jackson, Astronaut","","",""
"jellyfish with a crispy flaky crust","","",""
"Kobe Bryant trail cam footage","","",""
"Abbey Road with The Muppets","","",""
"Darth Vader as Gargamel","","",""
"Muppets, drawn by M. C. Escher","","",""
"Guitar hero hamster","","",""
"Dapper dinosaur in noir detective series","","",""
"Dwight as the Pope","","",""
"Mariachi band at the south pole","","",""
"Lettuce have a good time","","",""
"steampunk tigger","","",""
"Turok mowing the lawn","","",""
"Psyduck's college wrestling days","","",""
"Golden Girls Anime","","",""
"Plankton Crucified","","",""
"A still of Homer Simpson in Psycho (1960)","","",""
"ロボ金魚.","","",""
"Xenomorph eating McDonalds Happy Meal","","",""
"Drake as a Fortnite character","","",""
"Hamster Extreme Metal Album Cover","","",""
"Tokyo Nights","","",""
"Retirement Home flash mob","","",""
"Desc: Nicolas Sarkozy in rap music video.","","",""
"Elmo with an assault rifle","","",""
"Rambo talking to a psychiatrist","","",""
"darth vader playing with children at the playground","","",""
"Minions Guest-star in Silent Hill 2","","",""
"Snoop visits Victorian England","","",""
"High Resolution character art of Matt Berry as Wolverine","","",""
"voldemort pole dancing at walmart","","",""
"The Sultans of Squash","","",""
"Slender Man at a Weight Watchers meeting","","",""
"Christ the Redeemer as an Elden Ring Boss","","",""
"Osama Bin Laden GTA loading screen","","",""
"Elmo kissing Ted Cruz on a yacht","","",""
"THE EVIDENCE IS RAW!","","",""
"Al Abama","","",""
"Hitler on a unicycle eating bread","","",""
"Dr Phil in a UFC fight","","",""
"But it's not you","","",""
"J.K. Simmons in GTA","","",""
"filthy frank?","","",""
"Queen Elizabeth eating a pineapple","","",""
"Mark Zuckerberg police sketch","","",""
"something fun for r/weirdalle","","",""
"fetus inside a mayonnaise container","","",""
"Walker Texas Ranger in the style of Mondrian","","",""
"Racoon washing its food in a washing machine","","",""
"Joker and Lady Gaga musical","","",""
"Mulder trying to convince Scully that ALF is real","","",""
"pillsbury doughboy wedding","","",""
"Banksy is the duck","","",""
"Jimi Hendrix working the DMV counter","","",""
"nba game in a underwater","","",""
"Tiger King meeting Stephen Hawking","","",""
"Jack Sparrow Competes on The Great British Bake-Off","","",""
"darth vader vs darth maul boxing match","","",""
"More cats storming the U.S. Capitol on January 6","","",""
"Steve Harvey as UFC champion","","",""
"Fudge","","",""
"i will","","",""
"Goku flying into the twin towers","","",""
"The algorithm has gone too far","","",""
"Things painted by Pablo Picasso","","",""
"The couch is a gateway to hell","","",""
"3D surrealism style 🤯","","",""
"new york graffiti","","",""
"Monet painting of Legolas solving a Rubik's cube","","",""
"Boss Baby as a Runescape NPC","","",""
"Jim Halpert in the supreme court","","",""
"¿AuronPlay?","","",""
"The Pope in bed with John and Yoko","","",""
"Call of Duty with trombones","","",""
"Ronald McDonald drunk on 2-4-1 margaritas at a Chili's","","",""
"Dumbledore at Hooters","","",""
"Negative political cartoon of Tony Soprano","","",""
"Steve Zissou riding a dolphin","","",""
"Mysterio new league of legends champion","","",""
"donald trump bathing in a sea polluted whit garbage","","",""
"I bet these are existant","","",""
"ultra muffin man of oz","","",""
"Tony sopranos my 600 pound life","","",""
"After all these years, I’ve finally found it. The Stankey Leg","","",""
"dogs driving a fisheye skateboard","","",""
"A fried chicken holding a gun while smoking weed","","",""
"Banksy is the pope","","",""
"Freddie Mercury in Michelangelo's frescos","","",""
"Ham Sandwich doing drugs","","",""
"Casey Neistat In The Shining","","",""
"I don't remember this part of the Mario series...","","",""
"orangutan whit headphones walking at the bottom of the sea","","",""
"Kermit","","",""
"Barney and Friends running a sweatshop in Indonesia","","",""
"Not so Fantastic Mr. Fox","","",""
"cat plating basketlball in underwater","","",""
"Vader Baywatch","","",""
"Barney the Dinosaur post-Covid","","",""
"Slobodan Milošević on The Price Is Right","","",""
"Honey Boo Boo winning the Boston Marathon","","",""
"cat playinf futbool in underwater","","",""
"George costanza collectible figurines","","",""
"Karl Marx Dragon Ball","","",""
"Llama with a facemask performs surgery","","",""
"orangutan wheelchair 🍔","","",""
"Skrek dunking on Michael Jordan","","",""
"A pokemon modeled after a peanut butter jelly sandwich","","",""
"A donkey in the ellen show","","",""
"Goofy taking a selfie at the January 6th insurrection","","",""
"The Far Side as imagined by Craiyon","","",""
"Dall-e has no idea what a prime number is!","","",""
"Don't Touch That","","",""
"Sayings, idioms and colloquialisms #4","","",""
"Clown Darth Vader","","",""
"romantic dinner with morbius","","",""
"Wuthering Waters","","",""
"Fisher Price my first drug paraphernalia set","","",""
"Drake eating dog food from a toilet bowl.","","",""
"BEHOLD The Sound of Music starring Elvira","","",""
"My First Gallows!","","",""
"An egg arm wrestling a raptor","","",""
"Snoop Dogg as a Simpsons character","","",""
"a mexican icon","","",""
"Frozen Caveman Heads in an Ice Tray","","",""
"Shrek shooting in Valorant","","",""
"A dumpling buddy for a playmate","","",""
"How the AI see ""humans""","","",""
"Ugly sonic's face caught on thermal camera","","",""
"Shrek shooting in Valorant","","",""
"hee hee","","",""
"capybara smoking a cigarette underwater","","",""
"Oh my god","","",""
"adolf hitler the office cameo","","",""
"Kanye West in a bathtub full of waffles","","",""
"Carl fredricksen (UP) in playboy mansion","","",""
"A bottle of water being tried in court","","",""
"Gigachad Joker","","",""
"Shrek praying in a mosque","","",""
"Kermit with a flamethrower","","",""
"Osama Bin Laden drawn in the style of Diary of a Wimpy Kid","","",""
"Freddy Krueger as a soccer/futbol referee","","",""
"Jimmy Neutron Magic the Gathering card","","",""
"Gru working on KFC","","",""
"Dinosaurs invading a walmart","","",""
"Spiderman stealing russian tank","","",""
"Freddy Fazbear at Medieval Times","","",""
"The Joker default dancing at a funeral","","",""
"bored ape","","",""
"Jared Fogle playing the trumpet in quicksand","","",""
"Saitama vs Mario","","",""
"""The""","","",""
"Darth Vader at the 2020 Presidential Debate","","",""
"Fisher-Price My First Mona Lisa","","",""
"Snoop Lightyear","","",""
"Kim Kardashian Meets Insane Clown Posse","","",""
"this is for sure the best website","","",""
"Asked Dall-E Mini what it looks like...","","",""
"jam on, little dudes","","",""
"The Babadook astral projecting","","",""
"Call of Duty with Kermit the Frog","","",""
"Bill Cosby giving communion","","",""
"Hulk Hogan frying an egg","","",""
"Boris Johnson having a party","","",""
"Snoop catches rabies","","",""
"Ewan McGregor was just really hungry","","",""
"Ted Cruz stealing a pool noodle from costco","","",""
"Boris Johnson firing a cannon","","",""
"Snoop Dogg holding a dildo","","",""
"Neil Gaiman presenting an Oscar to a banana","","",""
"This was one of my first attempts I'm pleased with how it came out","","",""
"Priti Patel eating an immigrant","","",""
"1880s Furby Anatomical Drawings","","",""
"Ronald Reagan signing deal with Ronald McDonald","","",""
"Fat Batman on a roller coaster","","",""
"Trees with anxiety. I’m gonna waste so much time with this tool","","",""
"Kevin Bacon eating bacon","","",""
"Gender Reveal Wildfire","","",""
"Sayings, idioms and colloquialisms #3","","",""
"Kermit in Casablanca","","",""
"Kermit in Schindler’s List","","",""
"Probably already been done before but I thought I should add what I got when I tried it.","","",""
"Slime monsters trying to rob a bank","","",""
"Generating progressively different album covers is kind of nice.","","",""
"a golden god","","",""
"Dinosaur Chef","","",""
"A 1997 Pontiac Sunfire on America's got Talent","","",""
"A claw machine filled with breast implants","","",""
"Gummy bears on a stripper pole","","",""
"Vladimir Putin wearing a dunce cap and eating chocolate pudding","","",""
"donkey kong and his big bananas by warhol","","",""
"vader sumi-e","","",""
"He’s definitely heckling customers in the parking lot.","","",""
"Chuck Norris falling down the stairs","","",""
"marilyn monroe by botero","","",""
"Among Us Last Supper","","",""
"kirby sumi-e","","",""
"Demogorgon in Pulp Fiction","","",""
"roman reigns has left the ring! and entered the backrooms","","",""
"tattoos","","",""
"This ai can do things. Fed it some weird prompts, but Griffith…","","",""
"Shrek at the Tiannamen Square Massacre","","",""
"George Costanza eating a popsicle made of grass","","",""
"when solid snake is good driver","","",""
"What have I done.......","","",""
"Benedict cumberbatch as a half-life character","","",""
"Barney gets spaced on The Expanse","","",""
"Cookie Monster Patronus","","",""
"Donald Trump Littlest Pet Shop Toy","","",""
"Evergreen Container Ship as a Fortnite event","","",""
"Darth Vader with an afro","","",""
"Philippine map jordan logo","","",""
"✨ Shai-hulud magical girl transformation ✨","","",""
"performing fashion surgery","","",""
"Wienermobile 9/11","","",""
"Frasier Crane Wearing Traditional Japanese Outfits and Playing the Shamisen","","",""
"Looking like a 70’s rock album.","","",""
"Oliver and Company","","",""
"Dianna Troi eating a hotdog in Picard's ready room","","",""
"I feel quite proud of this one 🥰","","",""
"Fisher-Price electric chair","","",""
"trader joe’s baptism","","",""
"Hotdog in a blender at sunset","","",""
"Sora on trial to explain the plot of Kingdom Hearts","","",""
"Elmo as a Sith Lord… What have I done…","","",""
"Sayings, idioms and colloquialisms #2","","",""
"Black metal jesus sets fire to an orphanage","","",""
"a capybara going through the TSA security line at the airport","","",""
"Jonbenet Ramsey on the Masked Singer","","",""
"Gene Simmons in Van Gogh's paintings","","",""
"I made a few","","",""
"Thomas the Schwerer Gustav","","",""
"Pineapple head man on trial","","",""
"amazing","","",""
"Snoop Hogg","","",""
"Leatherface doing hot yoga","","",""
"ursula at walmart","","",""
"Dora the Explorer reading the Torah in Bora Bora holding a menorah","","",""
"bread deathmetal album cover","","",""
"Barack Obama petting a cat","","",""
"Bloody Cujo at the Westminster Kennel Club Dog Show","","",""
"Adele using a Dell","","",""
"trollface in a padded cell","","",""
"The Boss Baby graduating with a diploma","","",""
"cctv footage of michael jackson moonwalking through a park","","",""
"Toad Destroyer of Worlds","","",""
"Hillary Clinton in the Matrix","","",""
"Alberto Fernández ( current president of argentina) in the backrooms","","",""
"Trapped in a PC","","",""
"Batman sitting on the toilet.","","",""
"An atomic blast looking cool","","",""
"the Israelites in the desert worshipping a golden pickle rick","","",""
"weirddalle","","",""
"BEHOLD Thanos working at Subway","","",""
"Sonic honoring the troops","","",""
"Darth Vader winning great British bake off","","",""
"Filthyfrank in a torture dungeon","","",""
"Ben Shapiro Toilet","","",""
"fat burglar stuck in mirror maze","","",""
"Sayings, idioms and colloquialisms #1","","",""
"Gigachad as a dark souls boss","","",""
"John Wayne Gacy in a pie eating contest","","",""
"pride darth vader profile pic","","",""
"rudy giuliani taking a bubble bath","","",""
"Hyper realistic 🤮","","",""
"Jesus Christ in Wrestlemania","","",""
"Darth Vader loves sand","","",""
"Graffiti of chicken nuggets?","","",""
"Zangief having some good time","","",""
"This may take the cake","","",""
"1970's Xenomorph Roller Disco","","",""
"Jar Jar Binks snorting cocaine","","",""
"Stephen Hawking on a roller coaster","","",""
"Pewdiepie operating the radio on a German submarine","","",""
"Walrus wearing a beret.","Hiveharbinger","I'm not gonna lie. I don't know the difference between that and Jamie either. They're identical.","6"
"Walrus wearing a beret.","Fishman23","Anything else with Jamie in it comes out as just Jamie. It doesn't know the difference between Jamie and a walrus. ""Jamie Hyneman as a walrus = Jamie"" ""Jamie Hyneman mixed with a walrus = Jamie"" etc..","7"
"Walrus wearing a beret.","DrunkleSam47","On this episode of Mythbusters:","12"
"Walrus wearing a beret.","Hiveharbinger","You could have just typed in Jamie Hyneman and gotten the same result.","39"
"Walrus wearing a beret.","Fishman23","What’s up, Adam?","45"
"I like big butts and I cannot lie","","",""
"Turned out pretty amazing! A glowing Trex playing a guitar!","","",""
"Sasquatch painted by Francisco Goya","","",""
"Spider-Man on Top Chef","","",""
"Raining cats and dogs","","",""
"Hitler kissing his homies goodnight","","",""
"Marjorie Taylor Blue","","",""
"Because it's what the people want","","",""
"Order in the Court!","","",""
"Keanu Reeves being mean","","",""
"Lion taking selfie with selfie stick","","",""
"Jesus walking on water in america got talent","","",""
"The end of the world","","",""
