"post","author","comment","upvotes"
"Waluigi playing darts in an impressionist painting","","",""
"Barbarian Trump","","",""
"Stephen Hawking at Hooters","","",""
"The next president of the United States","","",""
"MJ in an N64 game","","",""
"Winnie the pooh by H R Giger","","",""
"guy taking a shower of meteors","","",""
"BIll Burr eating a burrito in a bar","","",""
"huuuhhh... ARRGHHHH!!","","",""
"I asked for a X-Ray of an apple.","","",""
"WWE Super Slam but it's Sesame Street","","",""
"Best actor in a comedy","","",""
"Strip pole in classroom","","",""
"Guy Fieri in Gladiatior","","",""
"Corn on the cob going down a waterslide","","",""
"Joe Biden erotica","","",""
"Donald Trump at Chuck E. Cheese","","",""
"Mommy's Kissin' Saaaaaanta Claaaaaaaussss","","",""
"Minions at End of Evangelion","","",""
"Napoleon dynamite anime","","",""
"will smith russian soldier","","",""
"Subway surfers Jake running away from his pain","","",""
"medieval drawing of Napoleon dynamite","","",""
"Turtle playing the piano","","",""
"Kim Jong Un in the backrooms","","",""
"Elon Musk as God","","",""
"Tellytubby fighting in the UFC","","",""
"Freddie Fazbear at a disco","","",""
"A bong drawn like an anime villain","","",""
"Elmo going over Niagara Falls","","",""
"Kermit in whiplash","","",""
"Bob the builder building the Taj Mahal","","",""
"he might be fun at parties","","",""
"Yoda vs Xenomorph","","",""
"Graffiti of demogorgon","","",""
"Dalle e Minis biggest fear","","",""
"An attractive woman.","","",""
"font pack","","",""
"Wanna see how deep it gets","","",""
"corgi patronus","","",""
"Thanos at Taco Bell","","",""
"AI generated photo","","",""
"Vladimir Putin shirtless centaur","","",""
"Razer gaming grand piano","","",""
"Blues clues meets pulp fiction","","",""
"Jesus smoking","","",""
"Are you alive?","","",""
"Ronald McDonald in the Psych Ward","","",""
"Communist Barbie","","",""
"xenomorph alien receiving the vaccine en","","",""
"Andy Warhol painting of Mace Windu riding Cthulhu","","",""
"Peep the Horror","","",""
"hey look","","",""
"Ready to be launched into the sea","","",""
"Fiona","","",""
"Nun Doing a Kickflip","","",""
"Mario Kart in Pixar Cars","","",""
"Papier mache Jeff Goldblum's head","","",""
"super mario funeral","","",""
"github mascotte","","",""
"Star wars in the middle age","","",""
"Red hot chili peppers eating red hot chili peppers","","",""
"The great punk rock baking show","","",""
"A tour group taking selfies with Cthulhu in R'lyeh","","",""
"Ancient Roman Bitcoin","","",""
"Homelander on American idol","","",""
"just a normal Tuesday night","","",""
"Ronald McDonald MMA","","",""
"peter griffin time travelling","","",""
"photorealistic pasta-human hybrid","","",""
"Gandalf decides to indulge a little","","",""
"demogorgon doing ballet","","",""
"I'd like to thank the (Starfleet) Academy","","",""
"Bill Cosby stealing a cupcake","","",""
"I've never seen it make such coherent faces before! (lost footage of encounter with your mother)","","",""
"Lizzo on a trampoline","","",""
"Vape God","","",""
"waluigi in an abandoned alley","","",""
"Master Chief daguerreotype","","",""
"osama bin laden bratz doll","","",""
"A bronze statue of Marilyn Monroe wrestling a lion","","",""
"unexpected, but correct","","",""
"Snoop Dogg trapped in a jar","","",""
"American Civil War the musical","","",""
"The Joker getting slimed at the kids choice awards","","",""
"Squidward on acid","","",""
"Gigachad dog","","",""
"Cloud Strife riding a harley","","",""
"""The stars are wrong, Jon.""","","",""
"graffiti of steve urkel","","",""
"Rick & Morty play burning man","","",""
"George Washington vs King George III in a boxing ring","","",""
"Meaning of Life","","",""
"Farmer milking a cockroack","","",""
"Xenomorph play basketball with Jesus","","",""
"Noam Chomsky action figure with accessories","","",""
"Buddha is Nirvana's frontman","","",""
"Ronald McDonald at a funerl in a casket","","",""
"Marvin the Martian on Mars","","",""
"Deadpool in ""My Neighbor Totoro""","","",""
"Trump as Jigsaw","","",""
"Cthulu Playing the Banjo","","",""
"it turns out the property brothers were also at the january 6th insurrection","","",""
"Things made of nightmares by Shel Silverstein","","",""
"Dave navarro showing neo, trinity, and morpheus how to live mas in the matrix","","",""
"cockroach playing chess","","",""
"Vader Enjoying Some Flowers","","",""
"monopoly board game with meat","","",""
"Dan Aykroyd in Supreme Court","","",""
"i did this instead of work","","",""
"Dr Neo Cortex balling","","",""
"Boris Johnson wearing a tinfoil hat","","",""
"Voldemort wearing bifocals","","",""
"Dalle mini","","",""
"Marlon Brando eating KFC","","",""
"chillbo swaggins","","",""
"Ki Adi Mundi performing a one man show of Hamlet","","",""
"Lego Moon Lander","","",""
"queen elizabeth ii playing slot machines","","",""
"x-ray of a minion that ate a toy car","","",""
"clay bust of fat elvis","","",""
"Giant kirby attacks tokyo","","",""
"Muppets in Vietnam","","",""
"A bottle of dubstep","","",""
"Didn’t know about this version of Sesame Street..","","",""
"Goofy ahh looking nerf guns","","",""
"van gogh painting of boris johnson eating pizza","","",""
"Kim k and fidel castro","","",""
"President Trump beating the Ender Dragon","","",""
"Darth Vader in ancient Egypt","","",""
"luka megurine dresses as a mariachi kissing donald trumps anime version in the backrooms","","",""
"Mike Tyson punching the Queen","","",""
"New fortnite update","","",""
"mhm.. okay","","",""
"Pigeon in an astronaut suit","","",""
"Muppet x-rays","","",""
"Surgeons performing pepperoni transplant","","",""
"Jesus at strip club","","",""
"Edgar Allan Poe Body Pillow","","",""
"bush but slowly turning into a bush doing 9/11","","",""
"ronald reagan meeting the paw patrol","","",""
"Kirby Eating the World's Biggest Burger","","",""
"a school shooting in the 1940s","","",""
"Western duel on the Champs-Élysées","","",""
"The face of our Creator","","",""
"Carousel Kebab","","",""
"Sonic funeral","","",""
"Not safe even swimming in slime 👀","","",""
"Gritty on South Park","","",""
"2 Polish movie posters: Capybara reading newspaper, Obama eating hot dog","","",""
"naked joe biden bathing in a small pond surrounded by peaceful vegetation","","",""
"Sadako from the ring in a boxing fight","","",""
"Unleash the Ultra Beast!","","",""
"Cat rave!","","",""
"Fall Guys Patent","","",""
"Scary reaction meme","","",""
"Evil deeds are up this quarter","","",""
"Donkey Kong, why?!","","",""
"obese slave leia","","",""
"Won't be easy to let this go","","",""
"Benito Mussolini playing some golf","","",""
"Donald Trump doing Tarot card readings","","",""
"Buddha smokes some buddha","","",""
"Rey Mysterio eating spaghetti in the ring","","",""
"Cavoodle graduation!","","",""
"Teletubbies at a fine dining restaurant","","",""
"Heisenberg Piñata","","",""
"My First Torture Rack","","",""
"Big Bird goes to the dentist","","",""
"Minions fighting in world war 2","","",""
"Princess Diana wins at Wrestlemania","","",""
"Rodney Dangerfield Opening Christmas Presents","","",""
"Roman legionnaires attack a flock of geese.","","",""
"Giant rat attack new york","","",""
"pope eating spaghetti","","",""
"Cavoodle in a speedboat","","",""
"Darth Vader during the irish potato famine","","",""
"Cute cartoon of an axolotl and an aye-aye on a date","","",""
"researchers researching","","",""
"I guess it nailed the thumbnail","","",""
"Bob Ross King of the Hill","","",""
"Iron man at a PTA meeting","","",""
"Chewbacca eats a fig","","",""
"Voldemort in a spacesuit","","",""
"Vladimir Putin working on a DIY missile","","",""
"Thomas the tank engine at a bar mitzvah","","",""
"These purebred velociraptors are the best","","",""
"Has anyone typed in what it thinks it looks like?","","",""
"Santa Claus summiting Everest","","",""
"Ferb in the Vietnam war","","",""
"Climbing Everest with a Lamborghini","","",""
"CCTV Footage of Pearl Harbor","","",""
"Joker 2, The Musical","","",""
"Barney singing at Beyoncé's coachella performance","","",""
"Gordon Ramsay looking for the lamb sauce in a maze","","",""
"Teaching young girls about life goals since 1959","","",""
"Ronald McDonald in ancient hieroglyphs","","",""
"A shark pushing a grocery cart on the ocean floor","","",""
"A Picture of Myself","","",""
"Putin wins an Oscar","","",""
"Toilet Paper attack","","",""
"Hasidic Jew Twitch Streamer","","",""
"Ronald McDonald eating a salad in the situation room","","",""
"peacock feathered tyrannosaurus rex","","",""
"igloo toilet","","",""
"daguerreotype of Abbath","","",""
"Stephen Hawking Dunk Contest","","",""
"steampunk darth vader","","",""
"Ghandi drinking with Stephen hawking impressionist painting","","",""
"my first guillotine","","",""
"Hatsune Miku marries Woody Woodpecker","","",""
"capybara at CBGB in 1976","","",""
"The Brady Bunch being pallbearers","","",""
"Psycho shower scene with Big Bird","","",""
"Rambo offering people french fries","","",""
"fisher price my first resonance cascade","","",""
"Steampunk Espresso Maker","","",""
"Psycho shower scene painted by Renoir","","",""
"edp445 in Skyrim","","",""
"Most amazing bestest cats ever","","",""
"fisheye lens view of jesus eating potato chips","","",""
"Dieguito","","",""
"Jerma at Pride Parade","","",""
"fisher price crucifixion","","",""
"dogs operating heavy machinery","","",""
"Kool-aid man at jonestown massacre","","",""
"I’m wondering if any non-British person will recognise this legendary athlete.","","",""
"Furry in a Trial","","",""
"stripper elephant wearing high heels photography","","",""
"Soul of Cinder chased by a swan","","",""
"Shrek and Edward Scissorhands fishing and hugging","","",""
"Barbie torture chamber","","",""
"Pewdiepie Eating Pugs","","",""
"Marble sculpture of buff Jesus","","",""
"Elmo N00se","","",""
"pov gopro footage fighting Thanos","","",""
"Tutankhamun's NFT collection","","",""
"Kaiman hanging out at CBGB","","",""
"Frog in suit","","",""
"The Rock eating a muffin","","",""
"Dall-E is really just an interdimentional camera","","",""
"Gigantic nose at Area 51","","",""
"Anubis giving a Ted Talk","","",""
"SS officers on Survivor TV show","","",""
"Karl Marx on the dollar bill","","",""
"Kim jong un in a bathtub playing with a rubber duck","","",""
"Stephen Hawking playing basketball on the moon","","",""
"Mr T delivering the State of the Union speech","","",""
"Shrek testifies to congress","","",""
"""Hi"" (I just typed ""hi"" in the prompt box and this is what it gave me)","","",""
"Muppets by Trevor Henderson - THE BOTTOM RIGHT ONE THO","","",""
"Charles Manson story hour","","",""
"zebra wearing a cowboy hat by Zdzisław Beksiński","","",""
"Albert Einstein and Tupac kissing","","",""
"Dat Boi by Zdzisław Beksiński","","",""
"shrek in jjba part 3 stardust crusaders","","",""
"an icon of Saint Darth Vader","","",""
"Saturn Devours His Son painting in the style of Lisa Frank","","",""
"bone apple teeth","","",""
"Artzybasheff","","",""
"Vaporwave Scooby Doo","","",""
"Highway interchange with traffic jam next to Hyrule Castle","","",""
"4 Privet Drive on fire","","",""
"Gorden Ramsay being angry at a cucumber","Lumiere_de_hibou","that's how angry he is, he's made himself a mustache out of them","9"
"Gorden Ramsay being angry at a cucumber","PurpleSlurple385","I especially like the bottom middle one where he's decided to sport a cucumber mustache.","21"
"photorealistic skeletor shopping for shoes","","",""
"ford mustang 1969 air to air dogfight","","",""
"McMessiah","","",""
"Chief Keef Tours a Refugee Camp, visits Arlington National Cemetery, and takes part in Pride Month","","",""
"Red Dead Zelda","","",""
"Darth Vader on the Office","","",""
"The Terminator by Jeff Koons","","",""
"Romance knows no bounds.","","",""
"Satan dressed as a mailman","","",""
"Dinosaurs boarding Noah’s Ark","","",""
"m i l k","","",""
"nightmare","","",""
"angry Tusken Raiders in a bobsleigh","","",""
"vladimir putin, yaoi style","","",""
"congratulations morb, you’re no longer a girl, you’re a woman.","","",""
"Obi Wan eating shrimp","","",""
"power rangers but they're chihuahuas","","",""
"WWE match underwater","","",""
"Bike thieves stealing an e-bike, oil on canvas, 1628","","",""
"Alex Jones from infowars celebrating pride month with a frog","Still_Butterfly7967","He finally accepted his gay frog!","8"
"Alex Jones from infowars celebrating pride month with a frog","Ref_Bumps","I AM the gay frog!","12"
"Alex Jones from infowars celebrating pride month with a frog","dinosaurscanfly","this may be my favourite one of these i’ve seen","12"
"Capitol Riots, The Game","","",""
"Burrito sleeping in street","","",""
"Polaroid photos of Kaiman from Dorohedoro on vacation","","",""
"Trump in a bath of burger sauce","","",""
"pope francis ice skating","","",""
"Jesus appears in an enchilada","","",""
"Gandhi as Colossus of Rhodes holding a banana","","",""
"saul goodman wearing a maid dress","","",""
"Ronald McDonald in grand theft auto vice city","","",""
"Walter White kissing Jimin","","",""
"Kratos fighting the pope","","",""
"Wikihow to attract a big tiddy goth girl","","",""
"metallic clay sculptures","","",""
"Gandhi holding a rifle","","",""
"Jesus Eating Tacos at Target","","",""
"guys, i think he needs help","","",""
"Ronald McDonald with a Knife","","",""
"K (fail)","","",""
"john cena sitting on a chair","","",""
"pikachu living his best life","","",""
"Vladimir Putin arm wrestling with Warwick Davis","","",""
"PS2 Game: Joe Biden’s Hair Sniffing Adventure","","",""
"p*ssypass denied!","","",""
"Pope Francis chainsaw a tree","","",""
"xenomorph dancing with a raccoon on the moon","","",""
"Nugget poker party","","",""
"Tony Hawk’s Pro Cock Fighting","","",""
"Bob Ross as santa","","",""
"the founding fathers hanging on a street corner","","",""
"Pope Francis eating cereal","","",""
"Beautiful.","","",""
"Dwight Schrute picking beets","","",""
"Snoop comes to kill Sarah Conner","","",""
"Morbidly Obese Chewbacca","","",""
"photorealistic Kaiman from Dorohedoro","","",""
"Walmart Wedding","","",""
"Walter White in McDonalds ball pit","","",""
"Kebab in a strip-club.","","",""
