"post","author","comment","upvotes"
"Trump riding a dinosaur whilst holding a lightsaber tattoo","","",""
"Stephen Hawking flying using a jetpack","","",""
"Stone Cold on a unicycle in space","","",""
"Lego Pepe","","",""
"HE FINALLY HAS LEFT","","",""
"Miranda Sings taking selfies during the Boston Bombing","","",""
"Mark Zuckerberg Halloween Mask","","",""
"Buff Adolf Hitler lifting weights","","",""
"The last supper at the Krusty Krab","","",""
"Cthulhu as a guest star on Star Trek","","",""
"Orson Welles Yelling at a Weasel","","",""
"Giant squid lands safely on airport runway","","",""
"Wayne Knight driving a ups truck","","",""
"Deadpool dead in a pool","","",""
"Dora the explorer on a motorcycle made out of the monkey it seems..","","",""
"another mash up","","",""
"Marge Simpson shooting an M1 Garand","","",""
"CCTV camera footage of Darth Vader break dancing","","",""
"Bob the Builder with an M240","","",""
"Pope Francis breakdance battle","","",""
"Pyramid head from silent hill making a pizza","","",""
"Matt Walsh dressed in drag","","",""
"Sirenhead singing on stage","","",""
"Kirby at the Last Supper","","",""
"Oprah biting a snake GoPro footage","","",""
"Slenderman getting his suit from the dry cleaners","","",""
"freddy fazbear's crucifixion","","",""
"🗿 gets some style","","",""
"Various Pokemon caught mugging homeless people on CCTV","","",""
"I'm going to hell for this","","",""
"Children setting a house on fire with ronald mcdonald","","",""
"a cat made of strawberry","","",""
"Borat playing for Real Madrid","","",""
"Slipknot flipping burgers at Burger King","","",""
"Greta thunberg has a change of heart","","",""
"Tupac in a western movie","","",""
"Self portrait? (AI model drawing images from any prompt)","","",""
"Tilda Swinton Playing French Horn","","",""
"“I got caught committing war crimes… I’d better call Saul!”","","",""
"Patent drawing of infinity gauntlet","","",""
"Sauron's wedding in Vegas","","",""
"Amber Heard Cleaning Bed","","",""
"Kevin Spacey staring menacingly from a foggy alley","","",""
"Kebab Shop Underwater","","",""
"subscribe to his channel","","",""
"Sepia-tone photo of Hello Kitty on the Oregon Trail","","",""
"Bald LeBron James","","",""
"Mark Zuckerberg as a cowboy riding a giant lizard","","",""
"Harambe StarCraft unit portrait","","",""
"Minotaur doing a slam dunk","","",""
"Hairy Potter","","",""
"Man in a wheelchair going down a waterslide","","",""
"boris johnson spaghetti hair","","",""
"Smart Fortwo in Dark Souls 2","","",""
"CCTV footage of gollum eating lembas bread","","",""
"Pre-Raphaelite Snooki","","",""
"bizarre monster photo stock","","",""
"Iron Man in Stranger Things","","",""
"Jack Black Yelling at Broccoli","","",""
"Smart Fortwo staring into the sunset longingly","","",""
"Christmas Crungus!","","",""
"floppa covid mask","","",""
"YouTuber Filming Their Dad's Funeral","","",""
"SpongeBob in the Oval Office","","",""
"Guys in wheelchairs jousting","","",""
"Jar Jar eating a lightsaber","","",""
"Darth Vader eating chilaquiles","","",""
"Historians will deny this, but Hatsune Miku signed the Treaty of Versailles","","",""
"Honda Accord above the Sea of Fog","","",""
"santa spaghetti","","",""
"I know it's an overused format, but","","",""
"Slenderman Surfing","","",""
"young paul mccartney","","",""
"NBA youngboy at a furry convention","","",""
"Buried alive selfie","","",""
"Magic Messi","","",""
"Cheesus Christ","","",""
"Ragnar Lothbrok disco dancing","","",""
"Drag Queen Steve from Blue’s Clues","","",""
"Menacing","","",""
"he will never ballin'...","","",""
"Waluigi","","",""
"good luck sleeping","","",""
"Trabant Burnout gender reveal","","",""
"Betty White as a hologram performing with Snoop Dogg","","",""
"stargazing mermaid drinking coffee in a walled garden","","",""
"CCTV Gollum robbing a jewelry store","","",""
"Polaroid pictures of Richard Simmons","","",""
"New Fortnite Event","","",""
"don't forget the crackers","","",""
"Obama riding a dolphin","","",""
"Michael Myers playing hide and seek with children in a playground","","",""
"Elmo robbing a bank","","",""
"Gandalf boxing Mike Tyson","","",""
"You think you know a guy... - Bob The Builder Building A Wall Along The US Mexico Border","","",""
"Ron Artest eating shrimp","","",""
"Shakespearean wallaby playing the fiddle","","",""
"John Cena devouring a hotdog by Francisco Goya","","",""
"Chief Keef playing clarinet","","",""
"Seinfeld but it's muppets","","",""
"Voldemort WFH","","",""
"Mark Zuckerberg in the backrooms","","",""
"among us cult meeting in the middle of a forest","","",""
"Kermi the Frog with a pearl earring","","",""
"Trump as Saturn eating a pigeon","","",""
"Mickey Mouse in the Bayeux tapestry","","",""
"Mike Tyson boxing Gumby","","",""
"Comics have been weirder lately...","","",""
"Jesus and Satan playing golf","","",""
"Our mother","","",""
"A Tardigrade Consuming Print Media in Various Locations (a series).","","",""
"Demogorgon in an 80s aerobics video","","",""
"spider-man: homeless","","",""
"Hamburger in a Bathtub","","",""
"Margaret Thatcher eating a Greggs sausage roll","","",""
"Gollum Mukbang","","",""
"Ah yes., My Favorite Desktop assistants.","","",""
"Screaming Kenneth Copeland painted by Francis Bacon","","",""
"hello kitty dashcam footage","","",""
"Mario Kart racing in Formula 1","","",""
"The Grim Reaper holding the World Cup","","",""
"Pigeon invasion at Disney World","","",""
"Hitler plush doll","","",""
"Paimon from Genshin Impact shaking Obama's hand","","",""
"Chris Farley arguing with a glass of milk","","",""
"jesus sitting on a toilet","","",""
"90's fast food logo","","",""
"Tony the Tiger goes Super Saiyan","","",""
"drag queen polly pocket","","",""
"The Trapper Keeper I Wish I Had","","",""
"Elmo at a klan meeting","","",""
"Gisele on the Patriots","","",""
"Car made out of teeth","","",""
"i want him to defend my Lands","","",""
"Paper airplane flying into Twin Towers","","",""
"Bears with lightsabers fighting","","",""
"pubic hair connected with bluetooth","","",""
"Satan, pharo and jesus playing poker","","",""
"Sydney Sweeney Ping Pong","","",""
"Tf2 heavy marrying Lightning McQueen","","",""
"MF DOOM in ELDEN RING","","",""
"Vintage photo of darth vader playing with swings","","",""
"Joe Biden yelling at a cat stuck in a tree","","",""
"Jake Paul boxing match against Barney the dinosaur","","",""
"Toddler doing a Wheelie","","",""
"No caption needed i guess","","",""
"Austin Powers nursing school","","",""
"first person view in a space invaders videogame","","",""
"Chibi Walter white","","",""
"Cat Picasso Art","","",""
"Lisa Frank Xenomorph","","",""
"mr lonely","","",""
"an electric wiring of the hair","","",""
"Bernie Sanders prayer candle","","",""
"Darth Zuckerberg","","",""
"Razer gaming banjo","","",""
"Slayer Claus","","",""
"Dolly Parton Regular Show cameo","","",""
"Sleep paralysis demon in the dark eating soup","","",""
"high heels croissants","","",""
"She-Hulk hurriedly breastfeeding Hulk at Arby's","","",""
"Chewbacca playing quidditch","","",""
"hercules trying to give his cat a pill, photorealistic","","",""
"Beyoncé in bathub with Le Corbusier","","",""
"Jessica Simpson in Morbius","","",""
"mona lisa wearing a euphoria inspired makeup","","",""
"toes connected through wi-fi","","",""
"Satan having a birthday party","","",""
"Jason Voorhees Boiler Room DJ set","","",""
"Sheet Ghost Doll","","",""
"Steve Harvey lost in Silent Hill","","",""
"Stalin Cooking Bread","","",""
"Storm in a teacup","","",""
"Lisa Frank Ghostface","","",""
"SNOPPY DOG","","",""
"zombie trump attacking eiffel tower","","",""
"Lisa Frank Cthulhu","","",""
"Bigfoot posing for selfies with people","","",""
"poop icecream","","",""
"Jeff Goldblum as he lead singer of Gwar","","",""
"abandoned us navy ship on mars","","",""
"McDonald’s worker deep frying a tree","","",""
"Giga chad in Fortnite","","",""
"Spiderman jumping the Grand Canyon on a motorcycle","","",""
"It didn‘t really understand the Walmart part","","",""
"Elvis depressedly","","",""
"Brazilian artist","","",""
"I raise your horse doing a burnout and give you a turtle doing a burnout","","",""
"Cute ngl","","",""
"traffic cone-themed birthday party","","",""
"Blank room soup (the AI didn‘t get the reference)","","",""
"marx santa","","",""
"Hello Kitty in the Black Lodge from Twin Peaks","","",""
"Eating a booger as an act of protest","","",""
"biscuits come ashore","","",""
"The beginning and the ending of the universe","","",""
"George pulled a fucking gun in bottom left panel","","",""
"Fisheye lens, trump singing karaoke","","",""
"Dog lawyer","","",""
"Tyler1 clash royale card","","",""
"Fisheye lens, teenagers dealing drugs on the school yard","","",""
"Logan Paul giving UN speech","","",""
"Courtroom sketch of Kermit and Miss Piggy custody battle","","",""
"Burglar stealing potato salad from buffet","","",""
"Obama clone vat","","",""
"The Late-night show with Gandhi","","",""
"Leaked new game","","",""
"Velociraptor working a temp job as a ticket conductor at local train station","","",""
"Teletubbies at the Battle of Verdun","","",""
"miniaturized version of a political party","","",""
"gollum cake","","",""
"Beautiful","","",""
"Robert Mapplethorpe fairy","","",""
"Axl Rose competing in an egg and spoon race","","",""
"Turtle pizza","","",""
"All might meeting Kim Jong-Un","","",""
"Tom Waits in dancing tutu","","",""
"Donald Trump fighting a wolf in the woods","","",""
"A mascot for the Olympic games in Nazi Germany","","",""
"Daft Punk performing underwater","","",""
"Chief Keef in The Simpsons","","",""
"A hockey puck in a soup","","",""
"plague doctor performing at a death metal concert","","",""
"I think he would be a center fielder","","",""
"zombies on european parliament","","",""
"Wario in ghillie suit with sniper rifle","","",""
"Fisher Price My first lightsaber","","",""
"Byzantine painting of Tony Montana","","",""
"Jonesy Fortnite in a Maid Outfit","","",""
"cctv of a creepy clown in a warehouse at night","","",""
"Chris Dorner birthday clown","","",""
"Stay hydrated","","",""
"19th century photo of Tina Belcher","","",""
"Nicolas Cage as a Roblox character","","",""
"Hockey puck filled with goulash","","",""
"My Little Dothrakis","","",""
"Barack Obama biking on the Wii Island","","",""
"Squid Game Pride","","",""
"POV: you just took a drink in bill cosby's house.","","",""
"The Wiggles ft. Slipknot","","",""
"A Calculator Made of Meat","","",""
"I love lucy aliens","","",""
"Denethor eating a pastrami sandwich","","",""
"Magic ball rat","","",""
"David Byrne finds himself in a beautiful house with a beautiful wife","","",""
"tourists taking pictures of a giant wii remote in a museum","","",""
"Lovecraft monster commemorative plate","","",""
"Clown pope in his bouncy cathedral","","",""
"Cthulhu is an astronaut","","",""
"Xenomorph crashing a kid's birthday party","","",""
"Donald Trump in a mankini","","",""
"Danny Devito dressed as Baphomet","","",""
"Devil Horns and Sharing Lessons","","",""
"Kool aid man storming the beaches at the Battle of Normandy","","",""
"Saul Goodman at the Nuremberg Trials","","",""
"Firefighters blowing bubbles","","",""
"boris johnson punk rocker","","",""
"Nelson Mandela smoking weed","","",""
"Gussy","","",""
"tried a new dall e generator","","",""
"Pink Guy in Vietnam War","","",""
"Pink Guy in WWE","","",""
"Gandalf at a hotdog eating contest","","",""
"Cow in orbit","","",""
"Baphomet Crochet","","",""
"Bowl of milk with crayons","","",""
"Godzilla riding a motorcycle through a post-apocalyptic wasteland","","",""
"Ben Shapiro at Tianamen Square","","",""
"Panda beer","","",""
"If you know you know","","",""
"Till Lindemann as a plushie","","",""
