"post","author","comment","upvotes"
"The Three Little Pigs present gifts to baby Jesus","","",""
"The Last Supper but Painted by M.C. Escher","","",""
"dumbledore being the DJ at a party and raising his left arm up in the air","","",""
"Kanye west doing yoga","","",""
"Michael Scott in the backrooms","","",""
"Horse Race at Mini Golf Course","","",""
"Billie Irish","","",""
"woman screaming while eating a salad","","",""
"EDP445 baking cupcakes with Gordon Ramsay","","",""
"Artificial intelligence gone mad","","",""
"Where freedom is a statue","","",""
"Steve Erwin Fights A Stingray","","",""
"Chocolate covered rockets","","",""
"ghost face babies","","",""
"Elizabeth Warren in Millenial Falcon cockpit","","",""
"hot dog soup","","",""
"A study of Beholders (From Dungeons & Dragons)","","",""
"Potato appearance on talk show","","",""
"Gordon Ramsay Mukbang","","",""
"Tony the Tiger at the Club","","",""
"intense","","",""
"this is true cinema","","",""
"The fat controller knows","","",""
"PS1 hagrid robbing a gas station","","",""
"Morty Smith fighting Mike Tyson in the ring","","",""
"Mike Ehrmantraut in Sesame Street","","",""
"Hannibal Lecter as an actual surgeon","","",""
"Boston Celtics leprechaun at presidential debate","","",""
"H R Giger painting of Bodhisttava","","",""
"Donald Trump Garbage Pail Kids Card","","",""
"Elden Ring Couch","","",""
"Eraserhead eating ribs","","",""
"Slimer as a cube shape","","",""
"I never knew I needed this","","",""
"Cinnamon Roll Snail","","",""
"michael myers dance off","","",""
"Frodo from Lord of the Rings working at McDonalds","","",""
"He’s having fun","","",""
"Mr T. getting on a plane","","",""
"Rave in a Costco","","",""
"Weird, i got normal images","","",""
"Colonel Sanders Cross-examining a Chicken, courtroom sketch","","",""
"playing baseball with a baguette","","",""
"Drunk shirtless guys having a party in hadron collider","","",""
"Elsa from Frozen playing beach volley","","",""
"Andre the Giant bobblehead","","",""
"The Iron Giant practicing slacklining","","",""
"I am once again asking you...say my name...","","",""
"collection","","",""
"Man selling beef tacos to people in a public restroom","","",""
"Still from M&Ms movie directed by Wes Anderson","","",""
"mother teresa dancing break dance","","",""
"queen elizabeth picking up garbage on the side of the highway","","",""
"LeChina","","",""
"Bernie Sanders Clash Royale Card","","",""
"Clock portrait on a desert painted by Dali","","",""
"Godzilla against the ministry of education","","",""
"Ronald McDonald in squid games","","",""
"Gritty joining Sherman's March to the Sea during the US Civil War","","",""
"Darth Vader wearing khaki pants on a sailboat","","",""
"Cthulhu pole dancing","","",""
"Dr. Seuss's Cat in The Hat Caught on CCTV","","",""
"Clifford the big red dog accepting an award at the Grammys","","",""
"Napoleon Bonaparte retrowave style","","",""
"Adolf Hitler ice-cream salesman","","",""
"Sonic makes a guest appearance on Hamilton musical","","",""
"Harry Potter in space with a gun","","",""
"Cheese and Pineapple on a hedgehog","","",""
"The Rumbles Factor part 2","","",""
"MLP Fortnite","","",""
"Excuse me, I have to go. Somewhere there is a horse crime happening.","","",""
"PSG lifting the Champions League trophy","","",""
"Hatsune Miku in jail","","",""
"DJ John","","",""
"The golden girls as Marvel's Avengers","","",""
"Kermit fighting in the landing of Normandy","","",""
"Stock photo of a man eating drywall","","",""
"Garfield Live Action Sitcom, starring Ted Danson.","","",""
"Jack Sparrow gopro footage","","",""
"cctv footage of the mandalorian trying to robber a bank","","",""
"This is my dream ngl","","",""
"We do a lot of dumb shit in this country","","",""
"Harambe dollar bill","","",""
"I hate how well this works","","",""
"SpongeBob at Benihana","","",""
"exclamation mark on a light grey background","","",""
"Blobfish Bayeux Tapestry","","",""
"Dalaï Lama drinking Champagne","","",""
"Elmo in the woods being mauled by a bear","","",""
"Michael Jackson Street Fighter","","",""
"A gummy bear in a bdsm dungeon","","",""
"CCTV footage of Darth Vader robbing a bank","","",""
"Gay farm animals celebrate pride","","",""
"Cal Kestis with a very fluffy cat.","","",""
"Freddy Krueger teapot","","",""
"People looking at an alarm clock swimming at the aquarium","","",""
"How DALLE sees himself","","",""
"Joe Biden Riding a Giraffe","","",""
"Close Enough","","",""
"Boris Johnson in Runescape","","",""
"Man wondering why his head is a Moyai","","",""
"Running up that hill","","",""
"The Rumbles Factor","","",""
"C3PO and R2D2 in The Hidden Fortress","","",""
"Seagull gangsters rap album cover","","",""
"Garfield, by Louis Wain","","",""
"Flying speghetti monster eating jesus at the last supper in stained glass","","",""
"Trump loves his pussys","","",""
"Fisher Price Ford F150","","",""
"Rasputin at pool party","","",""
"Wheelchair Races","","",""
"JFK dancing to cotton eye joe","","",""
"Skrillex voodoo doll","","",""
"Brontosaurus protesters","","",""
"Harriet Tubman Trail cam footage","","",""
"Anime about bees","","",""
"geometry dash arcade machine","","",""
"norman rockwell family gimpsuit","","",""
"Queen Victoria in JoJo's Bizarre Adventure","","",""
"MLK enjoying fried chicken","","",""
"Michelin man in Fernando Botero style","","",""
"What does it mean?","","",""
"Drunk shirtless guys wandering around Mordor","","",""
"Bob Dylan in Jack Vettriano style","","",""
"Bernie Sanders in GTA","","",""
"Flamengo Inazuma Eleven Team","","",""
"Chinese Takeaway Poodles","","",""
"Dodo bird inside Starbucks","","",""
"Octavian (Augustus) vs. Mark Antony, Lightsaber battle","","",""
"Cartman competing in the 2008 paralympics","","",""
"Greta Thunberg selling Monster Energy drinks","","",""
"Christopher Walken as member of the Ramones","","",""
"Gigachad Don Francisco","","",""
"remy from ratatouille playing air hockey at chuck e cheese","","",""
"Bad acid trip Nelson Mandela","","",""
"tin man in Kraftwerk","","",""
"Vaporwave Fallingwater","","",""
"CCTV footage of Immanuel Kant and emperor Palpatine stealing a burger, from https://twitter.com/ALogins","","",""
"based barbarian","","",""
"The Death Star over Victorian London","","",""
"Delicious steak in the shape of a heart","","",""
"waifu mad at me for being on the toilet too long","","",""
"a new generation of jedi","","",""
"Wizard of Oz in space","","",""
"Barney the Dinosaur State of the Union Address.","","",""
"Florida man","","",""
"Hitler drinking wine with kermit the frog","","",""
"TR riding a dinosaur","","",""
"cookie monster depicted in ancient egyptian cave painting","","",""
"Goofster","","",""
"Fortnite Auschwitz event","","",""
"Jimmy Carter on the Price is Right","","",""
"jesus in prison","","",""
"fisher price dildo","","",""
"Secure, Contain, Neigh","","",""
"Troll 19th century photo","","",""
"terminator in the toilet","","",""
"Impractical Jokers in a dialysis room","","",""
"Troll Face Neon Sign","","",""
"baroque painting of Mr. Mime","","",""
"Batman fat suit","","",""
"This is seems too obvious","","",""
"High speed photo of bullet shattering the Kool Aid Man","","",""
"Toronto Maple Leafs championship parade","","",""
"Yuri from Doki Doki Literature Club stuffing hotdogs into her mouth while crying inside a kiddie pool","","",""
"Razer tardigrade","","",""
"Keanu Reeves in 18th Century France","","",""
"forklift in skyrim","","",""
"Vampire hitler","","",""
"Nooticus Nooticus","","",""
"It's Always Sunny in Mordor","","",""
"Woody reads the bible","","",""
"Neil Patrick Harris dressed like a Monster Hunter","","",""
"Dwyane Johnson performs Smooth Jazz to a Kindergarten","","",""
"Sun Wukong driving a Ferrari","","",""
"John Rambo Picking Flowers","","",""
"north korea propaganda poster of garfield","","",""
"Trail cam footage of Jim Carrey in The Mask","","",""
"Albert Putin!","","",""
"Glass of blood on the bus","","",""
"Kazuma Kiryu appears on an episode of The Tonight Show with Jimmy Fallen","","",""
"Balding Albert Wesker... reminds me of somebody","","",""
"Orc hip hop album cover","","",""
"It just melts in my mouth","","",""
"emojis, they're the future","","",""
"Vladimir Putin neon sign","","",""
"Woody in the backrooms","","",""
"Aliens Skateboarding.","","",""
"Mulder and Scully host The Price is Right","","",""
"Tow Mater in Wolfenstein","","",""
"Hitler at Disneyland","","",""
"Catholic Father baptizing a child on Splash Mountain","","",""
"We do be like that","","",""
"lovcraftian angels","","",""
"Courtroom sketch of Patrick Star on trial (DALL-E took liberties with this)","","",""
"An egg on a stripper pole","","",""
"Pope mud wrestling","","",""
"Trail cam footage of Nagito Komaeda","","",""
"Joe Biden eating ice cream","","",""
"You make me wet","","",""
"T-rex","","",""
"nintendogs cemetery","","",""
"MP Snorlax speaks in the commons","","",""
"Blanka reading a book and drinking tea in Street Fighter II","","",""
"jonesy fortnite","","",""
"Gigachad shirtless by Rembrandt","","",""
"pet rock at Walmart","","",""
"prolife rally as a sunday morning cartoon","","",""
"big bird in court","","",""
"Thomas Jefferson holding a minigun","","",""
"Obama Shrek wedding","","",""
"Jesus as strongman","","",""
"Tony Soprano Italian condottiere. ""It is better to be feared than loved","","",""
"Mr Bean as a Gothic Vampire","","",""
"tomcruise","","",""
"Smash Mouth trespasses Shrek's swamp","","",""
"Very detailed medical illustrations of E.T. in old book","","",""
"Lego DDLC","","",""
"Pixar Thriller music video","","",""
"Salvador Dali In a Deli Making DALL-E","","",""
"King Julian working at costco","","",""
"The force is strong with this legume","","",""
"Rabbit Cylon","","",""
"Cats sleeping soundly","","",""
"IKEA instructions for sex","","",""
"Brr brr deng","","",""
"Godzilla destroys the twin towers","","",""
"yoda chasing kids with a chainsaw","","",""
"Donald Trump on Drag Race","","",""
"Shaq in The Backrooms","","",""
"Startrek Vats","","",""
"Steampunk Waterslide","","",""
"Baby yoda enjoying the sunset and a beer","","",""
"A Huge Pink Furry Hummer","","",""
"Slenderman at a kids birthday party","","",""
"Fish eyed lens kangaroo riding a unicycle","","",""
"Breaking Bad: The Musical","","",""
"Mr Spock with a spork","","",""
"Ronald McDonald Funeral","","",""
"Illegal Street toddler racing","","",""
"Uncanny Valley. I hate this so much","","",""
"Keanu Reeves in LOTR","","",""
"Gandalf as Master Assassin from Assassin's Creed","","",""
"Airplane made of potatoes","","",""
"Welcome to the NWO","","",""
"Sephiroth waiting on a prostrate exam","","",""
"Vladimir Putin working at a McDonald's","","",""
"razer gaming faberge egg","","",""
"Holy shit","","",""
"Gandalf in apple store","","",""
"Gir gets hit by a truck","","",""
"Just like any Monday","","",""
"naaaah man this is totally fine.","","",""
"Dio and Applejack do a mukbang","","",""
"new york skyline with dildos instead of buildings","","",""
"Is anyone hungry?","","",""
"Cookie Monster in Citizen Kane","","",""
"my recent creations :)","","",""
"squirrel with a flame thrower","","",""
"Elmo GTA loading screen","","",""
"chihuly bong","","",""
"Leonardo DaVinci paints Leonardo DiCaprio","","",""
"jesus working his job as a carpenter","","",""
"Chris Pratt sitting on the toilet","","",""
"depressed captain planet","","",""
"hatsune miku as a homestar runner character","","",""
"elmo in the boston massacre","","",""
"Kebab Inside The ISS","","",""
"Pennywise talking to a therapist","","",""
"dinosaurs voting in 2002 turkish elections","","",""
"A human octopus harvesting some radishes","","",""
"Leonardo DiCaprio and Kate Winslet laying on a door in the ocean","","",""
"Ron Jeremy playing chess","","",""
"Something actually original","","",""
"Johnny Knoxville Medieval Knight","","",""
"My first radioactive waste","","",""
"Bob Barker in Smash","","",""
"Ron Swanson as a professional wrestler","","",""
"greta thunberg in ball pool","","",""
"News anchor Jar-Jar Binks","","",""
"Cyberman doing taxes","","",""
"Steve Irwin captures himself","","",""
"Slimer teapot","","",""
"Giant corgi attacking New York","","",""
"Fiat Multipla x Tesla Cybertruck (sort of)","","",""
"Slender man driving ATV","","",""
"Asian Horror","","",""
"Marty McFly and Doc Brown learning how to use a smartphone","","",""
"Lil baby on deadliest catch","","",""
"Mussolini does a kickflip","","",""
"Queen Elizabeth driving a Formula 1 car","","",""
"Mariah Carey smoking a bong","","",""
"cat abducted by aliens","","",""
"A meerkat giving a graduation commencement speech","","",""
"Frodo Baggins on Mt. Doom trail cam","","",""
"Classical painting of Iron Man wearing a wig","","",""
"Vaporwave possum","","",""
"AI Hitler","","",""
"Cat with laser eyes in the style of Picasso","","",""
"Ronald McDonald at a funeral","","",""
"Toilet disco","","",""
"dobby as newborn mouse","","",""
"Ted Cruz escapes his zoo enclosure","","",""
"Demogorgon playing beach volleyball","","",""
"A morbidly obese guy singing at a concert","","",""
"Garfield themed toilet paper","","",""
"kermit experiencing lsd","","",""
"Well, there's that","","",""
"""Baldi eating spaghetti at a cinema""","","",""
"DALL·E mini","","",""
"Aphex Twin Come to Daddy","","",""
"Hitler realdoll","","",""
"The Little Mermaid as an H. R. Giger drawing","","",""
"Shrek showing his butt in skyrim","","",""
"Darth Vader vs Obi Wan in a Medieval painting style","","",""
"Donald trump as a fall guys character","","",""
"High School Musical in a cemetery","","",""
"I put Avatar: The Last Airbender in 4 different prompts and this is what happened","","",""
"ninja turtle laying eggs on beach","","",""
"Monster swimming with the fishes","","",""
"Jesus being crucified at Mar a Lago","","",""
"Jesus Christ on a rave","","",""
"when the tea tastes bad","","",""
"Guy doing pole vault my 600 lbs life","","",""
"Ben Shapiro in JNCOs","","",""
"BBM in RuPaul’s Drag Race","","",""
"Lest we forget…","","",""
"Julia Child makes a croquembouche","","",""
"DALL-E mini","","",""
"THIS HORSE! WTF?!?","","",""
"Mosasaurus flying next to a passenger airplane","","",""
"CCTV footage of darth vader making a sand castle","","",""
"shrunken head Pez dispenser","","",""
"Persian miniature painting of the Simpsons","","",""
"vladimir putin eating a poutine","","",""
"trollge","","",""
"dangerous dentistry","","",""
"Dali paints a Dalek","","",""
"Cat drives a formula 1 car","","",""
"Darth Vader at Chuck E Cheese","","",""
"Pillow battle during senate meeting","","",""
"Mario crucified","","",""
"jesus kissing a furry","","",""
"Toilet with bisexual lighting","","",""
"Funeral at 6 Flags","","",""
"pandas in fortnite","","",""
"As painted by Jon McNaughton","","",""
"This ended up much more wholesome than I intended","","",""
"Glitch in The Matrix creates too many rabbits","","",""
"Minion 9/11","","",""
"George Washington Driving a Ferrari","","",""
"Joseph Stalin wins a freestyle rap competition","","",""
"Iron Man playing drums at Glastonbury","","",""
"shocked youtube reaction thumbnail hindenburg","","",""
"Mr Blobby negotiating a peace deal with Putin","","",""
"King Kong smoking a cigar fisheye lens","","",""
"Ronald McDonald storming the Capitol","","",""
"Cthulhu board game piece","","",""
"Minion themed hospital","","",""
"Donald trump board game piece","","",""
"A washing machine full of pickles","","",""
"Steven Hawking in Minecraft","","",""
"Bigfoot getting married","","",""
"Daft Punk political cartoon","","",""
"Bigfoot accepting an award","","",""
"Stock photos of Jerry Seinfeld eating salad","","",""
"Kevin Bacon Painted by Francis Bacon","","",""
"Hogwarts students with guns","","",""
"Steve Jobs introduces a new AK47","","",""
"Nosferatu playing the violin","","",""
"WTF why is this so creepy","","",""
"Mitt Romney on Ru Paul’s Drag Race","","",""
"Godzilla Skateboarding compilation","","",""
"Aliens at the White House","","",""
"winged hussar skateboarding jumping over fiat 126p","","",""
"Yoda Devouring Grogu","","",""
"Jesus flipping an omelette","","",""
"Santa reading the Torah","","",""
"Elephant at a Rave","","",""
"Faberge eggs","","",""
"Underwater footage of the ninja turtle Leonardo eating an ice cream","","",""
"stone statue of vagina","","",""
"Hairless cat Klimt painting","","",""
"power rangers working at gas station","","",""
"Kermit in the Crimean War","","",""
"Mr Blobby in Silent Hill","","",""
"gandalf as samurai in style of yoji shinkawa","","",""
"gandalf as samurai in style of hokusai","","",""
"gandalf and balrog ufc cage fight","","",""
"Humpty Dumpty mugshot","","",""
"Storm Guys","","",""
"Gandalf overlooking troops in Afghanistan","","",""
"coyote peterson stung by a garden hose","","",""
"🎅 🎃 🌋","","",""
"Holyday in Tatooine","","",""
"Kratos eating ice cream at Disneyland","","",""
"looks good","","",""
"Nigel Farage in drag","","",""
"darth vader playing basketball on the paralympics","","",""
"Flying saucer at Battle of Stalingrad","","",""
"Peppa pig being crucified tattoo","","",""
"Greta Thunberg washing her car","","",""
"hulk hogan wrestling a giant banana","","",""
"All my questions have been questioned...","","",""
"criminal rex","","",""
"Giygas painted by Van Gogh","","",""
"darth vader riding a lawn mower tractor","","",""
"17th century photo of Darth Vader","","",""
"Beyoncé weightlifting in a pizza shop","","",""
"Forrest Gump runs to costco","","",""
"Bigfoot on the X Factor","","",""
"Albert Pujols driving a Subaru","","",""
"South Park Lil Darkie","","",""
"mike wazowski at a rave party","","",""
"Two cats fighting in a wwe match.","","",""
"Yellow vests protest with chimpanzees","","",""
"Danny DeVito dressed as an egg","","",""
"Inflatable funeral set","","",""
"batman sunbathing on a beach","","",""
"E.T. Extraordinary Thug","","",""
"Mark Zuckerberg as a ventriloquist doll","","",""
"demogorgon having tea at Buckingham Palace","","",""
"spiderman building a fence in a yard","","",""
"Harry Styles stuck in a fish tank","","",""
"Vietnam war in fortnite","","",""
"Puti loves the bouncy house","","",""
"Tony Soprano as the Wizard of Oz","","",""
"Larry David meets Yasser Arafat","","",""
"cowboy riding a dragon","","",""
"Jesus using a gaming computer","","",""
"Moses parting the Red Sea in a manga page","","",""
"H.R. Giger Jar Jar Binks","","",""
"Xenomorph signing the Declaration of Independence","","",""
"a grizzly bear at a chinese massage parlor","","",""
"weird dalle","","",""
"Sith Lords in a Park Being Chased By Geese","","",""
"Several cinematic adaptations of the Bible","","",""
"Chihuahua enjoying a blueberry muffin","","",""
"Homer Simpson and Ayrton Senna at Chernobyl Power Plant","","",""
"gumby winning the nba finals","","",""
"Amish people playing Mario kart","","",""
"BBQ party in surgery room","","",""
"cyberpunk unicorn","","",""
"Willy, what are you doing?","","",""
"Super Saiyan Obi-Wan","","",""
"Stephen Hawking on a skate ramp","","",""
"Cthulhu squishmallow","","",""
"Mike Tyson surfing in disco clothes","","",""
"Boris Johnson fall guys skin","","",""
"grinder","","",""
"the grim reaper playing hopscotch","","",""
"MRI of Pickle Rick","","",""
"Lofi Hitler","","",""
"Abraham Lincoln doing a TikTok dance","","",""
"King Julien at the Gettysburg address","","",""
"Am I wrong for this","","",""
"Llama doing a kickflip","","",""
"Hagrid as a Starbucks barista","","",""
"Elmo at the JFK assassination","","",""
"Minions depicted in ancient carving","","",""
"Mogwai playing with fire","","",""
"Big bird in an open casket funeral","","",""
"Staypuff marshmallow man roasting marshmallows on a stick","","",""
"Pizza with teeth eyes horror","","",""
"A cow in a church","","",""
"Pizza Surgery","","",""
"Bold and brash painted by jean-michael basquiat","","",""
"I don't know what these are the largest of, but they certainly are the largest of them. (Some strong SCP vibes on this one...)","","",""
"Mark Twain sleeping with a penguin under a red quilt","","",""
"Balaclavas made of baklava?","","",""
"Elephant jumping over the Berlin wall.","","",""
"Flinstones Foam Party LFG LFG","","",""
"a pigeon in a suit","","",""
"Darth Vader goes to Albertsons","","",""
"Kermit visits Mecca and becomes Muslim","","",""
"oh George","","",""
"Donald Trump as a bean","","",""
"soviet propaganda cartoon of dwayne the rock johnson crying","","",""
"Bruce Willis in Dark Souls","","",""
"Baby smoking a bong","","",""
"Napoleon Bonaparte performing at Coachella","","",""
"Sailor Moon by Fernando Botero","","",""
"cctv footage of Jesus (with angel wings) wandering his cave tomb","","",""
"i was definitely not expecting this result.","","",""
"john Cena in Palestine","","",""
"Jesus as doom slayer","","",""
"messi playing accordion","","",""
"Handmaids Surround a Beached Whale","","",""
"Kanye West by Boris Vallejo","","",""
"Donald Trump in Attack on Titan","","",""
"Biden's Feeling The Pinch Too","","",""
"Axolotl birthday party!","","",""
"Jesus playing Monopoly","","",""
"POV: You hear Low Rider at 3 AM","","",""
"Star Wars Jar Jar Binks speech on Nuremberg trial","","",""
"Dua Lipa toy photography style","","",""
"minions during world war 2","","",""
"Pikachu driving a muscle car in a race","","",""
"A banana on shark tank","","",""
"MF Doom","","",""
"Dobby and Gollum's wedding","","",""
"Squidward Transformer","","",""
"jerma in jurassic park","","",""
"Chris christie eating a hot dog on cctv","","",""
"Jeffery Epstein riding a lawn mower that is on fire","","",""
"Out of this world","","",""
"Porous cars","","",""
"Mario fighting a giant pizza","","",""
"Winnie the Pooh splashing in a pool of blood","","",""
"A couple of results that made me chuckle","","",""
"Pole Vaulting at the Gimp Suit Olympics","","",""
"i need a hug","","",""
"walter","","",""
"Tits!","","",""
"Boris Johnson death metal band","","",""
"Pikachu Shopping At Whole Foods","","",""
"Snake water bottle","","",""
"Crinoid Political Cartoon","","",""
"Gotta Get New Plates For The Batmobile","","",""
"Fisheye lens dog vaping","","",""
"gumby at wwe event","","",""
"Jukebox floating in the river","","",""
"Obama bathing on a tub with noodles","","",""
"Fisher price butt plug","","",""
"Taco Bell Toilet Explosion","","",""
"Shrek with an AR15","","",""
"Jesus crying under the sower","","",""
"Tony Blair works at burger king","","",""
"rollercoaster hagrid","","",""
"capybara going through TSA security line","","",""
"Zoidberg Crossing The Delaware","","",""
"Waluigi roman mosaic","","",""
"Wario at a furry convention","","",""
"Enjoy","","",""
"Dolphin smooth Vin Diesel","","",""
"Colonel sanders with a five dollar fill-up meal in hand trail cam","","",""
"Luigi Spider","","",""
"Snoop Dog Stained Glass","","",""
"Tattoo of Hitler wearing a sombrero","","",""
"Steven Universe crucifixion","","",""
"Voldemort with a bong","","",""
"Paul Scholes eating a Big Mac","","",""
"Donald trump vaping","","",""
"The Jigsaw Killer playing jenga","","",""
"Rave in Kaaba","","",""
"A dog playing guitar","","",""
"inflatable Trump on Thanksgiving parade","","",""
"Goth unicorns at a rock concert","","",""
"Ewoks giving a corporate presentation","","",""
"C-3PO DJ set at a music festival","","",""
"Barney at the Capitol riot","","",""
"fire emoji moai emoji","","",""
"I just believe these people would be titans","","",""
"Alcoholic Beetlejuice","","",""
"cats dressed professionally holding a board meeting","","",""
"Little scamp","","",""
"A Very Normal Human Face","","",""
"Mickey Mouse as Spider-man","","",""
"Look at him go","","",""
"shrek dancing on the moon with jesus","","",""
"Abbath-day Cake","","",""
"cctv footage of shrek on fire","","",""
"bigfoot misses noah’s ark :(","","",""
"Shrek at the last supper","","",""
"Whatchu know about..","","",""
"Elton John Playing Tennis","","",""
"Satan sitting on a lawn chair on an ice rink reading the newspaper","","",""
"Futurama With Swords","","",""
"Dara O’Briain in Skyrim","","",""
"Bored of Bananas","","",""
"Eat Fresh","","",""
"Cthulhu photobombing beach selfies","","",""
"Mario Kart 9 revealed","","",""
"You had man yelling at a toast. I present to you Man yelling at toast.","","",""
"this is for brazil","","",""
"Massive Throbbing Cock","","",""
"Buzz Lightyear to Star Command...","","",""
"a cow doing a kickflip","","",""
"putin at gay parade in moscow","","",""
"Sauron breaking into a cookie container","","",""
"Fisher Price 9/11","","",""
"slash is laying basketball in a ball pit","","",""
"Toilet in Mars","","",""
"Mall of America filled with monsters","","",""
"Roman reigns kissing paul heyman","","",""
"Lenin face on the red moon surface","","",""
"14th Century painting of R2D2","","",""
"SCP-999 cooking up good on the BBQ","","",""
"Gritty playing saxophone","","",""
"Mordor by Seurat","","",""
"Gay Parade Moscow","","",""
"earth in a bathtub","","",""
"Yeezys melting on the hot pavement","","",""
"Emmanuel Macron eating french fries underwater","","",""
"Big tiddy goth gf","","",""
"caveman in a cyberpunk city","","",""
"help jesse im stuck in rainbow road","","",""
"the discovery of the archimedes theorem","","",""
"Hasselhoff eating a cheeseburger painted by banksy","","",""
"Lego mosh pit at a Limp Bizkit concert","","",""
"Eminem posing with spaghetti","","",""
"Lizzo eating a salad","","",""
"rule 5","","",""
"Gritty Mascot minotaur neon painting","","",""
"man shouting at a bowl of peas","","",""
"Kim Jong Un on an episode of the office","","",""
"Mel Gibson reading the Torah at synagogue","","",""
"romantic orc reading book by candlelight","","",""
"John Mayer fell off..","","",""
"clock","","",""
"Florida Man","","",""
"Gritty Mascot minotaur surrounded by flames neon painting","","",""
"Barney the Dinosaur on the Great British Bake off","","",""
"Nicolas Cage enjoys a pizza with Adolf Hitler","","",""
